{
    "id":  "code-20260415010543543",
    "type":  "task",
    "status":  "PENDING",
    "created_at":  "2026-04-15T01:05:43.5433694Z",
    "input":  {
                  "summary":  "CODE stage for: sample workflow for runtime smoke test",
                  "base_prompt":  "\u003ctask\u003e\r\nImplement the objective with minimal diffs: sample workflow for runtime smoke test\r\n\u003c/task\u003e\r\n\r\n\u003cproject_context\u003e\r\n- Read `CONTEXT.md`, `PLAN.md`, `Requirement.md`, `Architecture.md`, `HLD.md`, `DD.md`, and `milestone.md` when relevant.\r\n- Prefer `graphify-out/GRAPH_REPORT.md` over broad raw-file exploration when available.\r\n- Prefer linked markdown navigation when the project uses Obsidian.\r\n\u003c/project_context\u003e\r\n\r\n\u003cexecution_contract\u003e\r\n- Complete the task end to end when feasible.\r\n- Prefer minimal diffs and root-cause fixes.\r\n- Update `PLAN.md` and `CONTEXT.md` when the task changes project state materially.\r\n- If required context is missing, state exactly what is missing.\r\n\u003c/execution_contract\u003e\r\n\r\n\u003coutput_contract\u003e\r\n- Observed facts\r\n- Inferences\r\n- Files touched or likely to be touched\r\n- Verification performed\r\n- Risks or follow-up items\r\n\u003c/output_contract\u003e\r\n",
                  "prompt_template":  "task.md",
                  "prompt_file":  "C:\\Users\\MrSit\\source\\repos\\dotcodex\\.dotcodex-state\\jobs\\code-20260415010543543.prompt.md"
              },
    "output":  {
                   "output_file":  null,
                   "prompt_preview":  null,
                   "artifacts_index":  null,
                   "stderr_file":  null,
                   "events_file":  null,
                   "started_at":  null,
                   "completed_at":  null,
                   "exit_code":  null
               },
    "metadata":  {
                     "workflow_id":  "run-20260415010543347",
                     "dependencies":  [
                                          "dd-20260415010543518"
                                      ],
                     "created_at_legacy":  "2026-04-15T01:05:43.5433694Z",
                     "stage":  "CODE"
                 }
}
