{
    "id":  "review-20260415010543594",
    "type":  "review",
    "status":  "PENDING",
    "created_at":  "2026-04-15T01:05:43.5944964Z",
    "input":  {
                  "summary":  "REVIEW stage for: sample workflow for runtime smoke test",
                  "base_prompt":  "\u003ctask\u003e\r\nReview the requested change set or implementation target.\r\n\u003c/task\u003e\r\n\r\n\u003creview_target\u003e\r\nsample workflow for runtime smoke test\r\n\u003c/review_target\u003e\r\n\r\n\u003creview_contract\u003e\r\n- Prioritize correctness, regressions, security, performance, and missing tests.\r\n- Ground findings in the provided context and inspected files.\r\n- Prefer real findings over style commentary.\r\n\u003c/review_contract\u003e\r\n\r\n\u003coutput_contract\u003e\r\n- Verdict\r\n- Findings by severity\r\n- Open questions\r\n- Verification gaps\r\n\u003c/output_contract\u003e\r\n",
                  "prompt_template":  "review.md",
                  "prompt_file":  "C:\\Users\\MrSit\\source\\repos\\dotcodex\\.dotcodex-state\\jobs\\review-20260415010543594.prompt.md"
              },
    "output":  {
                   "output_file":  null,
                   "prompt_preview":  null,
                   "artifacts_index":  null,
                   "stderr_file":  null,
                   "events_file":  null,
                   "started_at":  null,
                   "completed_at":  null,
                   "exit_code":  null
               },
    "metadata":  {
                     "workflow_id":  "run-20260415010543347",
                     "dependencies":  [
                                          "test-20260415010543567"
                                      ],
                     "created_at_legacy":  "2026-04-15T01:05:43.5944964Z",
                     "stage":  "REVIEW"
                 }
}
